{
  "batches": [
    {
      "batch_id": "an-001-2025-10-07-00",
      "count": 3,
      "day": "2025-10-07",
      "leaf_hashes": [
        "168abce8b01931ed3e59aaf380cdf0a0706fa6c31c08dab65285b20a28842b8a",
        "57dfb9693e09132384b45d84c174dc1816e7d54e5aeb42a484fc5c0118fea049",
        "97358f1da38b74190dc6c033494bbc739c75e2ad427eb1fe4fd211332c6b207e"
      ],
      "merkle_root": "95f6c013cc5bc306a3b5bbb2484078b5491e36a8b0f4b32aab85d211ee562853",
      "site_id": "an-001",
      "version": 1
    }
  ],
  "date": "2025-10-07",
  "day_root": "95f6c013cc5bc306a3b5bbb2484078b5491e36a8b0f4b32aab85d211ee562853",
  "prev_day_root": "0000000000000000000000000000000000000000000000000000000000000000",
  "site_id": "an-001",
  "version": 1
}
